{
  "$schema": "https://json-schema.org/draft/2020-12/schema",
  "title": "TransitJSON Stop",
  "description": "TransitJSON v2 — Durak. Erişilebilirlik flag'leri, fiziksel özellikler ve opsiyonel platform dizisi içerir. parent_station ile metro istasyonu giriş/çıkış kapıları ve alt duraklar ana istasyona bağlanır. Tüm yeni alanlar opsiyoneldir; mevcut v1 kayıtları eksik/null bırakılarak da geçerlidir.",
  "type": "object",
  "properties": {
    "stop_id": {
      "type": "string",
      "description": "Proje genelinde tekil. Örn. '{city_id}-{sequence}' formatı önerilir: BUR-01023"
    },
    "city_id": {
      "type": "string"
    },
    "name": {
      "type": "object",
      "properties": {
        "tr": { "type": "string" },
        "en": { "type": "string" }
      },
      "required": ["tr"],
      "additionalProperties": { "type": "string" },
      "description": "Çoklu dil isim nesnesi. 'tr' zorunludur, diğer dil kodları (en, ar, de vb.) opsiyoneldir."
    },
    "lat": {
      "type": "number",
      "minimum": -90,
      "maximum": 90
    },
    "lon": {
      "type": "number",
      "minimum": -180,
      "maximum": 180
    },
    "location_type": {
      "type": ["string", "null"],
      "enum": ["stop", "station", "entrance", "generic_node", null],
      "description": "GTFS uyumlu konum tipi. stop: basit durak. station: istasyon/kompleks (birden fazla platform içerebilir). entrance: istasyon girişi/çıkışı. generic_node: yolcu erişimi olmayan geometrik nokta. null ise 'stop' kabul edilir."
    },
    "parent_station": {
      "type": ["string", "null"],
      "description": "Bu kayıt bir alt durak, giriş/çıkış kapısı veya platform ise üst istasyonun stop_id'si. location_type=station olan ana istasyon kayıtları için null. Örn. entrance 'BUR-ENT-OSMANGAZI-A' → parent_station 'BUR-STA-OSMANGAZI'."
    },
    "wheelchair_accessible": {
      "type": ["boolean", "null"],
      "description": "Tekerlekli sandalye ile durağa/durağın içine erişilebilir mi? null = bilinmiyor."
    },
    "has_ramp": {
      "type": ["boolean", "null"],
      "description": "Rampa var mı?"
    },
    "has_elevator": {
      "type": ["boolean", "null"],
      "description": "Asansör var mı?"
    },
    "has_tactile_paving": {
      "type": ["boolean", "null"],
      "description": "Görme engelliler için taktil yüzey var mı?"
    },
    "has_audio_announcement": {
      "type": ["boolean", "null"],
      "description": "Sesli yaklaşan araç/hat anonsu var mı?"
    },
    "has_braille_signage": {
      "type": ["boolean", "null"],
      "description": "Braille tabela var mı?"
    },
    "shelter_type": {
      "type": ["string", "null"],
      "enum": ["none", "open", "closed", "heated", null],
      "description": "Bekleme alanı türü. none: bekleme alanı yok. open: yarı kapalı/peron üstü örtü. closed: tam kapalı durak (camekanlı). heated: kapalı + ısıtmalı. null = bilinmiyor."
    },
    "has_bench": {
      "type": ["boolean", "null"],
      "description": "Oturma yeri var mı?"
    },
    "has_lighting": {
      "type": ["boolean", "null"],
      "description": "Aydınlatma var mı?"
    },
    "has_real_time_display": {
      "type": ["boolean", "null"],
      "description": "Canlı kalkış saati ekranı var mı?"
    },
    "has_ticket_machine": {
      "type": ["boolean", "null"],
      "description": "Bilet makinesi var mı?"
    },
    "has_trash_bin": {
      "type": ["boolean", "null"],
      "description": "Çöp kutusu var mı?"
    },
    "has_wifi": {
      "type": ["boolean", "null"],
      "description": "Ücretsiz WiFi var mı?"
    },
    "has_security_camera": {
      "type": ["boolean", "null"],
      "description": "Güvenlik kamerası var mı?"
    },
    "has_bike_rack": {
      "type": ["boolean", "null"],
      "description": "Bisiklet parkı var mı?"
    },
    "platforms": {
      "type": "array",
      "description": "Bu durağa bağlı platformlar. Basit duraklarda boş veya 1 elemanlı; metro/tren istasyonları gibi büyük yapılarda birden fazla platform bulunabilir. Her platform kendi erişilebilirlik/fiziksel bayraklarını taşır; durağın kök alanlarından bağımsızdır.",
      "items": {
        "type": "object",
        "properties": {
          "platform_id": {
            "type": "string",
            "description": "Durak içinde tekil. Örn. 'BUR-STA-OSMANGAZI-P1' veya 'A'."
          },
          "code": {
            "type": ["string", "null"],
            "description": "İnsan-okunur platform kodu (A, B, 1, 2, vb.)."
          },
          "pattern_ids": {
            "type": ["array", "null"],
            "items": { "type": "string" },
            "description": "Bu platformu kullanan güzergâh varyantları (route_patterns.json içindeki pattern_id'lere referans). Yön bilgisi pattern üzerinden gelir. null = bilinmiyor/henüz bağlanmamış."
          },
          "lat": {
            "type": "number",
            "minimum": -90,
            "maximum": 90
          },
          "lon": {
            "type": "number",
            "minimum": -180,
            "maximum": 180
          },
          "wheelchair_accessible": {
            "type": ["boolean", "null"]
          },
          "has_elevator": {
            "type": ["boolean", "null"]
          },
          "has_ramp": {
            "type": ["boolean", "null"]
          },
          "has_tactile_paving": {
            "type": ["boolean", "null"]
          },
          "has_audio_announcement": {
            "type": ["boolean", "null"]
          },
          "shelter_type": {
            "type": ["string", "null"],
            "enum": ["none", "open", "closed", "heated", null]
          },
          "has_bench": {
            "type": ["boolean", "null"]
          },
          "has_lighting": {
            "type": ["boolean", "null"]
          },
          "updated_at": {
            "type": "string",
            "format": "date-time"
          }
        },
        "required": ["platform_id", "updated_at"],
        "additionalProperties": false
      }
    },
    "updated_at": {
      "type": "string",
      "format": "date-time"
    }
  },
  "required": [
    "stop_id",
    "city_id",
    "name",
    "lat",
    "lon",
    "updated_at"
  ],
  "additionalProperties": false
}